{"$schema":"https://json-schema.org/draft/2020-12/schema","$id":"https://recrafts.local/contracts/envelope-request.schema.json","type":"object","additionalProperties":false,"required":["protocol_version","request_id","operation","host","working_root","input"],"properties":{"protocol_version":{"const":"1.0"},"request_id":{"type":"string","minLength":1},"operation":{"enum":["capabilities","prepare-analysis","submit-analysis","validate-package","generate-realization","verify-fidelity"]},"host":{"type":"object","required":["agent","engine","capabilities"],"properties":{"agent":{"type":"string"},"engine":{"type":"string"},"capabilities":{"type":"array","items":{"type":"string"},"uniqueItems":true},"extensions":{"type":"object"}},"additionalProperties":false},"working_root":{"type":"string"},"input":{"type":"object"},"output_directory":{"type":"string"},"options":{"type":"object"}}}
